{
  "name": "edge",
  "description": "",
  "version": "",
  "pre-version": "",
  "homepage": "https://www.microsoftedgeinsider.com",
  "bug": "",
  "github": "",
  "releases": "https://www.microsoftedgeinsider.com/en-us/download/",
  "url": "",
  "url-mirror": "",
  "pre-url": "",
  "pre-url-mirror": "",
  "scripts": {
    "preinstall": "",
    "install": "",
    "postinstall": "",
    "preuninstall": "",
    "uninstall": "",
    "postuninstall": "",
    "pretest": "",
    "test": "",
    "posttest":""
  },
  "path": [

  ]
}
