{
  "name": "etcd",
  "description": "Distributed reliable key-value store for the most critical data of a distributed system",
  "version": "3.4.7",
  "pre-version": "3.4.7",
  "homepage": "https://etcd.io/",
  "bug": "https://github.com/etcd-io/etcd/issues",
  "github": "etcd-io/etcd",
  "releases": "https://github.com/etcd-io/etcd/releases",
  "url": "https://github.com/etcd-io/etcd/releases/download/v${VERSION}/etcd-v${VERSION}-windows-amd64.zip",
  "url-mirror": "https://mirrors.huaweicloud.com/etcd/v${VERSION}/etcd-v${VERSION}-windows-amd64.zip"
}
