{
  "name": "docker",
  "description": "Docker: the open-source application container engine",
  "version": "stable",
  "pre-version": "edge",
  "homepage": "https://www.docker.com/",
  "bug": "https://github.com/docker/for-win/issues",
  "github": "docker/docker-ce",
  "releases": "https://github.com/docker/docker-ce/releases",
  "url": "https://download.docker.com/win/stable/Docker%20Desktop%20Installer.exe",
  "pre-url": "https://download.docker.com/win/edge/Docker%20Desktop%20Installer.exe"
}
