{
  "name": "nginx",
  "description": "small, powerful, scalable web/proxy server",
  "version": "1.18.0",
  "pre-version": "1.17.10",
  "homepage": "https://nginx.org",
  "bug": "http://nginx.org/en/support.html",
  "github": "nginx/nginx",
  "releases": "https://nginx.org/en/download.html",
  "url-mirror": "https://mirrors.huaweicloud.com/nginx/nginx-${VERSION}.zip",
  "url": "https://nginx.org/download/nginx-${VERSION}.zip"
}
