{
  "name": "vim",
  "description": "Vi IMproved - enhanced vi editor",
  "version": "8.2.0539",
  "pre-version": "8.2.0539",
  "homepage": "https://www.vim.org/",
  "bug": "https://github.com/vim/vim-win32-installer/issues",
  "github": "vim/vim-win32-installer",
  "releases": "https://github.com/vim/vim-win32-installer/releases"
}
