{
  "name": "node",
  "description": "Node.js is a JavaScript runtime built on Chrome's V8 JavaScript engine",
  "version": "12.16.2",
  "pre-version": "14.0.0",
  "homepage": "https://nodejs.org/en/",
  "bug": "https://github.com/nodejs/node/issues",
  "github": "nodejs/node",
  "releases": "https://nodejs.org/en/download/",
  "url": "https://nodejs.org/dist/v${VERSION}/node-v${VERSION}-win-x64.zip",
  "url-mirror": "https://mirrors.tuna.tsinghua.edu.cn/nodejs-release/v${VERSION}/node-v${VERSION}-win-x64.zip"
}
