{
  "name": "minio",
  "description": "MinIO is a high performance object storage server compatible with Amazon S3 APIs",
  "version": "RELEASE.2020-03-25T07-03-04Z",
  "pre-version": "RELEASE.2020-03-25T07-03-04Z",
  "homepage": "https://min.io/",
  "bug": "https://github.com/minio/minio/issues",
  "github": "minio/minio",
  "releases": "https://github.com/minio/minio/releases"
}
