{
  "name": "example",
  "description": "",
  "version": "x.y.z",
  "pre-version": "x.y.z-alpha.1",
  "homepage": "",
  "bug": "",
  "github": "repo/name",
  "releases": "",
  "url": "",
  "url-mirror": "",
  "pre-url": "",
  "pre-url-mirror": "",
  "scripts": {
    "preinstall": "",
    "install": "",
    "postinstall": "",
    "preuninstall": "",
    "uninstall": "",
    "postuninstall": "",
    "pretest": "",
    "test": "",
    "posttest":"",
    "version": ""
  },
  "path": [
    "C:/bin"
  ]
}
